{
  "schemaVersion": "1.0",
  "dispatchId": "141578fe-b7d8-4b5a-bef2-6845557e7430",
  "storyId": "M4-A-001",
  "phase": "implementation",
  "ownerAgent": "backend-developer",
  "purpose": "Implement task-owned changes only.",
  "preparedRevision": 4,
  "preparedAt": "2026-07-17T07:27:51.223Z",
  "expectedOutputs": [
    ".harness/runs/M4-A-001/phases/03-implementation/implementation-notes.md"
  ],
  "allowedAdapters": [],
  "next": "unit-test"
}
