{
  "schemaVersion": "1.0",
  "dispatchId": "f291aeb4-aa11-4e0b-b46a-8d6bdfefa0a8",
  "storyId": "M3-001",
  "phase": "code-review",
  "ownerAgent": "code-reviewer",
  "purpose": "Review code changes and emit findings without modifying files.",
  "preparedRevision": 15,
  "preparedAt": "2026-07-16T14:58:51.482Z",
  "expectedOutputs": [
    ".harness/runs/M3-001/phases/05-code-review/code-review-report.md"
  ],
  "allowedAdapters": [],
  "next": "build-publish"
}
