{
  "schemaVersion": "1.0",
  "dispatchId": "f5a845f5-fa24-4c06-b7e8-cc9350313ff2",
  "storyId": "M4-A-001",
  "phase": "requirement",
  "ownerAgent": "requirement-analyst",
  "purpose": "Clarify the story, acceptance criteria, affected modules, and blocking questions.",
  "preparedRevision": 1,
  "preparedAt": "2026-07-17T07:16:37.040Z",
  "expectedOutputs": [
    ".harness/runs/M4-A-001/phases/00-requirement/requirement-breakdown.md"
  ],
  "allowedAdapters": [],
  "next": "technical-design"
}
