{
  "schemaVersion": "1.0",
  "dispatchId": "45400d10-3819-430e-a0d9-e2b06c0e5b4c",
  "storyId": "M3-001",
  "phase": "git-delivery",
  "ownerAgent": "git-committer",
  "purpose": "Summarize owned changes and prepare commit/PR only after explicit confirmation.",
  "preparedRevision": 19,
  "preparedAt": "2026-07-16T15:11:42.265Z",
  "expectedOutputs": [
    ".harness/runs/M3-001/phases/08-git-delivery/delivery-report.md"
  ],
  "allowedAdapters": [],
  "next": "done"
}
