{
  "schemaVersion": "1.0",
  "dispatchId": "fab1d40f-626c-4108-a195-0771aa2ffd55",
  "storyId": "M3-001",
  "phase": "build-publish",
  "ownerAgent": "publisher",
  "purpose": "Build and optionally publish after explicit confirmation.",
  "preparedRevision": 17,
  "preparedAt": "2026-07-16T15:09:56.465Z",
  "expectedOutputs": [
    ".harness/runs/M3-001/phases/06-build-publish/build-report.md"
  ],
  "allowedAdapters": [
    "harness-structure",
    "backend-package",
    "frontend-build",
    "no-build-required"
  ],
  "next": "interface-verification"
}
